{
  "type": "Coverage",
  "domain": {
    "type": "Domain",
    "domainType": "Grid",
    "axes": {
      "x": { "start": 14.10, "stop": 35.23, "num": 320 },
      "y": { "start": 57.75, "stop": 71.17, "num": 200 },
      "t": { "values": ["2001","2002","2003","2004","2005","2006","2007","2008","2009","2010","2011","2012","2013","2014","2015","2016","2017","2018"] }
    },
    "referencing": [
      {
        "coordinates": ["x","y"],
        "system": {
          "type": "GeographicCRS",
          "id": "http://www.opengis.net/def/crs/OGC/1.3/CRS84"
        }
      },
      {
        "coordinates": ["t"],
        "system": {
          "type": "TemporalRS",
          "calendar": "Gregorian"
        }
      }
    ]
  },
  "parameters": {
    "VAP": {
      "type": "Parameter",
      "description": {
        "en": "Start of Vegetation Active Period for coniferous forests derived from MODIS Fractional Snow Cover",
        "es": "Inicio del Periodo Activo de Vegetación para bosques de coníferas derivado de cobertura fraccional de nieve MODIS",
        "zh": "基于MODIS积雪覆盖的针叶林植被活跃期起始",
        "ro": "Începutul Perioadei Active a Vegetației pentru păduri de conifere derivat din acoperirea fracțională a zăpezii MODIS"
      },
      "unit": {
        "label": { "en": "Day of Year", "es": "Día del Año", "zh": "年日数", "ro": "Ziua anului" },
        "symbol": { "value": "d", "type": "http://www.opengis.net/def/uom/UCUM/" }
      },
      "observedProperty": {
        "id": "https://w3id.org/ogc/hosted/ebv-phenology/StartOfVAP",
        "label": {
          "en": "Start of Vegetation Active Period",
          "es": "Inicio del Periodo Activo de Vegetación",
          "zh": "植被活跃期起始",
          "ro": "Începutul Perioadei Active a Vegetației"
        }
      }
    }
  },
  "ranges": {
    "VAP": {
      "type": "NdArray",
      "dataType": "integer",
      "axisNames": ["t","y","x"],
      "shape": [18, 200, 320]
    }
  }
}
