{
  "type": "Coverage",
  "domain": {
    "type": "Domain",
    "domainType": "Grid",
    "axes": {
      "x": {
        "start": 14.1,
        "stop": 35.23,
        "num": 320
      },
      "y": {
        "start": 57.75,
        "stop": 71.17,
        "num": 200
      },
      "t": {
        "values": [
          "2001",
          "2002",
          "2003",
          "2004",
          "2005",
          "2006",
          "2007",
          "2008",
          "2009",
          "2010",
          "2011",
          "2012",
          "2013",
          "2014",
          "2015",
          "2016",
          "2017",
          "2018"
        ]
      }
    },
    "referencing": [
      {
        "coordinates": [
          "x",
          "y"
        ],
        "system": {
          "type": "GeographicCRS",
          "id": "http://www.opengis.net/def/crs/OGC/1.3/CRS84"
        }
      },
      {
        "coordinates": [
          "t"
        ],
        "system": {
          "type": "TemporalRS",
          "calendar": "Gregorian"
        }
      }
    ]
  },
  "parameters": {
    "VAP": {
      "type": "Parameter",
      "description": {
        "en": "Start of Vegetation Active Period for coniferous forests derived from MODIS Fractional Snow Cover",
        "es": "Inicio del Periodo Activo de Vegetaci\u00f3n para bosques de con\u00edferas derivado de cobertura fraccional de nieve MODIS",
        "zh": "\u57fa\u4e8eMODIS\u79ef\u96ea\u8986\u76d6\u7684\u9488\u53f6\u6797\u690d\u88ab\u6d3b\u8dc3\u671f\u8d77\u59cb",
        "ro": "\u00cenceputul Perioadei Active a Vegeta\u021biei pentru p\u0103duri de conifere derivat din acoperirea frac\u021bional\u0103 a z\u0103pezii MODIS"
      },
      "unit": {
        "label": {
          "en": "Day of Year",
          "es": "D\u00eda del A\u00f1o",
          "zh": "\u5e74\u65e5\u6570",
          "ro": "Ziua anului"
        },
        "symbol": {
          "value": "d",
          "type": "http://www.opengis.net/def/uom/UCUM/"
        }
      },
      "observedProperty": {
        "id": "https://w3id.org/ogc/hosted/ebv-phenology/StartOfVAP",
        "label": {
          "en": "Start of Vegetation Active Period",
          "es": "Inicio del Periodo Activo de Vegetaci\u00f3n",
          "zh": "\u690d\u88ab\u6d3b\u8dc3\u671f\u8d77\u59cb",
          "ro": "\u00cenceputul Perioadei Active a Vegeta\u021biei"
        }
      }
    }
  },
  "ranges": {
    "VAP": {
      "type": "NdArray",
      "dataType": "integer",
      "axisNames": [
        "t",
        "y",
        "x"
      ],
      "shape": [
        18,
        200,
        320
      ]
    }
  }
}